{
  "schema_version": "1.0.0",
  "source": {"source_id": null, "name": "Unknown legacy scientific archive example", "url": "https://example.org/legacy-archive"},
  "goal": {"scope_mode": "representative_chain", "completion_claim": "representative_only", "research_question": null},
  "observations": {
    "disciplines": ["unknown"],
    "origin_types": ["unknown"],
    "provenance_roles": ["unknown"],
    "production_modes": ["unknown"],
    "structural_archetypes": ["unknown", "proprietary_format"],
    "content_modalities": ["unknown"],
    "lifecycle_modes": ["unknown"],
    "versioning_models": ["unknown"],
    "access_regimes": ["unknown"],
    "sensitivity_classes": ["unknown"],
    "scale_classes": ["unknown"],
    "metadata_maturity": "undocumented",
    "languages": ["unknown"]
  },
  "scope": {"boundary_type": "unknown", "boundary_statement": "", "snapshot_at": null},
  "work_unit_strategy": {"unit_types": ["unknown"], "identity_rule": "", "partition_rule": "", "ordering_rule": "", "denominator_strategy": "unknown", "expected_count": null},
  "constraints": {"authorized_access": ["public_landing_page"], "prohibited_actions": [], "compute_limit": null, "notes": "Planning must remain evidence-seeking and must not claim completion."},
  "explicit_route_modules": [],
  "evidence": [{"url": "https://example.org/legacy-archive", "title": "Example legacy landing page", "evidence_type": "synthetic_test_fixture", "supports": ["planning_test_only"], "retrieved_at": "2026-08-19T00:00:00Z"}]
}
